{
  "source_id": "example-source",
  "name": "Design fixture, not live source",
  "method": "rest",
  "adapter_version": "0.1-design",
  "record_type": "document",
  "external_id_field": "id",
  "pagination": {
    "mode": "cursor",
    "checkpoint_after_durable_commit": true
  },
  "budget": {
    "max_requests": 10,
    "max_bytes": 10485760,
    "max_seconds": 300
  },
  "purpose": "RAG",
  "rights_status": "pending",
  "retention_policy_id": "raw-default"
}
